{"schemaVersion":"1.0.0","id":"redacted","fingerprintId":null,"surveyId":null,"sampleFormat":"signed-int8-interleaved-iq","componentOrder":"I,Q","byteOrder":"not-applicable-single-byte-components","centerFrequencyHz":433920000,"sampleRateHz":2000000,"requestedDurationMs":250,"startedAtEpochMs":1790000000000,"startedMonotonicNs":1000,"expectedByteCount":1000000,"actualByteCount":1000000,"complexSampleCount":500000,"gapCount":0,"overrunCount":0,"sha256":"bbbbbbbbbbbbbbbbbbbbbbbbbbbbbbbbbbbbbbbbbbbbbbbbbbbbbbbbbbbbbbbb","radio":{"basebandFilterHz":1750000,"lnaGainDb":0,"vgaGainDb":0,"rfAmpEnabled":false,"antennaPowerEnabled":false},"equipmentProfileVersionId":"redacted-profile","deviceSerialSuffix":null,"location":null,"note":"","versions":{"app":"0.4.0-m4","detector":"m2-detector-v1","clustering":"m2-fingerprint-v1","aggregation":"m3-grid-v1","profile":"redacted-profile"}}
