{"schemaVersion":"1.0.0","id":"example-capture","fingerprintId":null,"surveyId":null,"sampleFormat":"signed-int8-interleaved-iq","componentOrder":"I,Q","byteOrder":"not-applicable-single-byte-components","centerFrequencyHz":433920000,"sampleRateHz":2000000,"requestedDurationMs":1000,"startedAtEpochMs":1790000000000,"startedMonotonicNs":1000,"expectedByteCount":4000000,"actualByteCount":4000000,"complexSampleCount":2000000,"gapCount":0,"overrunCount":0,"sha256":"aaaaaaaaaaaaaaaaaaaaaaaaaaaaaaaaaaaaaaaaaaaaaaaaaaaaaaaaaaaaaaaa","radio":{"basebandFilterHz":1750000,"lnaGainDb":16,"vgaGainDb":16,"rfAmpEnabled":false,"antennaPowerEnabled":false},"equipmentProfileVersionId":"focused-fixed-16db-v1","deviceSerialSuffix":"1234abcd","location":{"crs":"EPSG:4326","latitude":42.123456,"longitude":-71.654321,"horizontalAccuracyM":8.5,"ageMs":1200},"note":"ambient receive-only example","versions":{"app":"0.4.0-m4","detector":"m2-detector-v1","clustering":"m2-fingerprint-v1","aggregation":"m3-grid-v1","profile":"focused-fixed-16db-v1"}}
